source,title,description,published_at,url,sentiment_positive,sentiment_negative,sentiment_neutral,sentiment_compound,sentiment_label
GoogleNews,Oil Prices Suffer Biggest Weekly Collapse in Two Months - Crude Oil Prices Today | OilPrice.com,Oil Prices Suffer Biggest Weekly Collapse in Two Months  Crude Oil Prices Today | OilPrice.com,2026-05-29 15:30:00,,0.0,0.454,0.546,-0.9674,Negative
GoogleNews,Brent oil price posts biggest monthly loss in six years as market counts on a U.S.-Iran deal - CNBC,Brent oil price posts biggest monthly loss in six years as market counts on a U.S.-Iran deal  CNBC,2026-05-29 15:21:25,,0.0,0.116,0.884,-0.5574,Negative
GoogleNews,Oil Prices Slip Amid Trump Demands; Exxon Warns Of Nasty Surprise - Investor's Business Daily,Oil Prices Slip Amid Trump Demands; Exxon Warns Of Nasty Surprise  Investor's Business Daily,2026-05-29 15:21:00,,0.113,0.269,0.618,-0.7003,Negative
GoogleNews,India's Central Bank Warns Oil Shock Threatens Growth - Crude Oil Prices Today | OilPrice.com,India's Central Bank Warns Oil Shock Threatens Growth  Crude Oil Prices Today | OilPrice.com,2026-05-29 14:30:00,,0.116,0.46,0.424,-0.9246,Negative
LiveMint_Markets,"<![CDATA[Crude oil prices slide 19% in May, post worst monthly fall since 2020; Will US-Iran peace deal deepen losses?]]>","Crude oil prices fell on 29 May after tentative US-Iran ceasefire talks raised hopes for smoother oil flows. Brent crude dropped nearly 19% in May, while WTI hovered around $87. Ongoing discussions may impact future prices amid geopolitical uncertainties.",2026-05-29 14:25:47,,0.085,0.228,0.687,-0.8908,Negative
GoogleNews,Supermajor Warns Oil Prices Could Hit $160 Within Weeks - Crude Oil Prices Today | OilPrice.com,Supermajor Warns Oil Prices Could Hit $160 Within Weeks  Crude Oil Prices Today | OilPrice.com,2026-05-29 14:00:00,,0.0,0.274,0.726,-0.8481,Negative
GoogleNews,"Oil output at Kazakhstan's Tengiz field shrinks after an accident, sources say - Reuters","Oil output at Kazakhstan's Tengiz field shrinks after an accident, sources say  Reuters",2026-05-29 13:36:39,,0.0,0.199,0.801,-0.7351,Negative
GoogleNews,"Current price of oil as of May 29, 2026 - Fortune","Current price of oil as of May 29, 2026  Fortune",2026-05-29 13:02:00,,0.0,0.0,1.0,0.0,Neutral
GoogleNews,Oil prices fall on hopes of Strait of Hormuz reopening - Financial Times,Oil prices fall on hopes of Strait of Hormuz reopening  Financial Times,2026-05-29 12:12:18,,0.196,0.0,0.804,0.6808,Positive
GoogleNews,Analysts hike oil forecasts again as energy flows face slow recovery: Reuters poll - Reuters,Analysts hike oil forecasts again as energy flows face slow recovery: Reuters poll  Reuters,2026-05-29 11:33:32,,0.135,0.0,0.865,0.4939,Positive
GoogleNews,Oil drops 20% from 2026 peak on optimism over U.S.-Iran ceasefire talks - CNBC,Oil drops 20% from 2026 peak on optimism over U.S.-Iran ceasefire talks  CNBC,2026-05-29 10:51:33,,0.219,0.0,0.781,0.7906,Positive
GoogleNews,Saudi Arabia Expected to Slash Oil Prices Again - Crude Oil Prices Today | OilPrice.com,Saudi Arabia Expected to Slash Oil Prices Again  Crude Oil Prices Today | OilPrice.com,2026-05-29 10:30:00,,0.0,0.317,0.683,-0.891,Negative
GoogleNews,The global oil market is running out of options: 'You cannot print molecules' - Yahoo Finance,The global oil market is running out of options: 'You cannot print molecules'  Yahoo Finance,2026-05-29 10:00:00,,0.0,0.0,1.0,0.0,Neutral
GoogleNews,AI Has Made Memory Chips More Valuable Than Oil - WSJ,AI Has Made Memory Chips More Valuable Than Oil  WSJ,2026-05-29 09:30:00,,0.263,0.0,0.737,0.7774,Positive
GoogleNews,"Indian Oil Corp buys 5 million barrels of crude from West Africa, Middle East, sources say - Reuters","Indian Oil Corp buys 5 million barrels of crude from West Africa, Middle East, sources say  Reuters",2026-05-29 08:57:44,,0.0,0.183,0.817,-0.8126,Negative
GoogleNews,Oil prices on track for steepest monthly fall since 2020 - The Guardian,Oil prices on track for steepest monthly fall since 2020  The Guardian,2026-05-29 08:33:00,,0.0,0.0,1.0,0.0,Neutral
GoogleNews,The ‘imminent’ oil crisis isn’t at the pump—it’s under your hood - Fortune,The ‘imminent’ oil crisis isn’t at the pump—it’s under your hood  Fortune,2026-05-29 07:06:00,,0.0,0.263,0.737,-0.8481,Negative
GoogleNews,Japan's April oil imports hit lowest since 1962 as Iran war disrupts supply - Reuters,Japan's April oil imports hit lowest since 1962 as Iran war disrupts supply  Reuters,2026-05-29 06:22:00,,0.0,0.342,0.658,-0.9186,Negative
GoogleNews,"Exxon warns oil inventories will hit dangerously low levels in weeks, forcing prices to shoot higher - CNBC","Exxon warns oil inventories will hit dangerously low levels in weeks, forcing prices to shoot higher  CNBC",2026-05-28 21:03:55,,0.0,0.397,0.603,-0.93,Negative
GoogleNews,NY Harbor ULSD Futures Overview - CME Group,NY Harbor ULSD Futures Overview  CME Group,2026-05-28 20:44:45,,0.0,0.0,1.0,0.0,Neutral
GoogleNews,"US imposes fresh sanctions on Iran's military oil sales, Treasury says - Reuters","US imposes fresh sanctions on Iran's military oil sales, Treasury says  Reuters",2026-05-28 20:26:00,,0.273,0.093,0.633,0.6597,Positive
GoogleNews,Chevron CEO warns oil prices to jump over summer as supplies dwindle - Financial Times,Chevron CEO warns oil prices to jump over summer as supplies dwindle  Financial Times,2026-05-28 18:49:05,,0.0,0.094,0.906,-0.2023,Negative
GoogleNews,Oil prices fall after report of breakthrough in US-Iran talks - BBC,Oil prices fall after report of breakthrough in US-Iran talks  BBC,2026-05-28 14:45:46,,0.0,0.0,1.0,0.0,Neutral
GoogleNews,The race for oil: will Jamaica be the next country to drill and what does that mean for its green pledges? - The Guardian,The race for oil: will Jamaica be the next country to drill and what does that mean for its green pledges?  The Guardian,2026-05-28 12:01:00,,0.0,0.0,1.0,0.0,Neutral
GoogleNews,America’s pile of emergency oil is shrinking fast - CNN,America’s pile of emergency oil is shrinking fast  CNN,2026-05-28 11:00:08,,0.0,0.234,0.766,-0.6369,Negative
GoogleNews,Commission discusses gas and oil supply risks with EU countries as the conflict in the Middle East reaches a 3-month mark - energy.ec.europa.eu,Commission discusses gas and oil supply risks with EU countries as the conflict in the Middle East reaches a 3-month mark  energy.ec.europa.eu,2026-05-28 09:36:27,,0.048,0.175,0.777,-0.7506,Negative
GoogleNews,Oil prices turn lower as U.S.-Iran ceasefire extension awaits Trump approval - CNBC,Oil prices turn lower as U.S.-Iran ceasefire extension awaits Trump approval  CNBC,2026-05-28 00:32:00,,0.273,0.137,0.59,0.5267,Positive
GoogleNews,Oil Futures Fall on Hopes for U.S.-Iran Agreement - WSJ,Oil Futures Fall on Hopes for U.S.-Iran Agreement  WSJ,2026-05-27 19:50:00,,0.444,0.0,0.556,0.9001,Positive
GoogleNews,Oil prices slide on hopes of US-Iran peace deal - BBC,Oil prices slide on hopes of US-Iran peace deal  BBC,2026-05-25 13:05:56,,0.426,0.0,0.574,0.9118,Positive
GoogleNews,Oil prices fall 7% after Trump says Iran talks are 'proceeding nicely' - CNBC,Oil prices fall 7% after Trump says Iran talks are 'proceeding nicely'  CNBC,2026-05-24 22:47:34,,0.188,0.0,0.812,0.7003,Positive
EconomicTimes_TopStories,<![CDATA[‘100 is just a number...let rupee depreciate or reserves will bleed out’: 16th Finance Commission chief Arvind Panagariya’s advice to RBI]]>,"Arvind Panagariya, Chairman of the 16th Finance Commission, advises the Reserve Bank of India to allow the Indian rupee to weaken. He believes aggressively defending the currency with foreign exchange reserves is a losing strategy. Panagariya suggests that letting the rupee depreciate is the correct response to rising oil prices and currency pressure.",2026-05-22 07:33:47,,0.023,0.126,0.851,-0.807,Negative
EconomicTimes_TopStories,"<![CDATA[FPIs pull out Rs 27,000 cr in May; 2026 outflows hit Rs 2.2 lakh cr-mark]]>","Himanshu Srivastava, Principal - Manager Research at Morningstar Investment Research India, said the latest outflow trend reflected persistent uncertainty surrounding global growth, elevated geopolitical tensions across key regions and volatility in crude oil prices, which continued to weigh on risk appetite towards emerging markets, including India.",2026-05-17 11:15:08,,0.037,0.16,0.802,-0.8221,Negative
EconomicTimes_TopStories,<![CDATA[Oil prices to hit $150? How Indian stock markets may react as Iran war rages on]]>,"Oil prices have surged past $100 per barrel amid escalating Iran–Israel tensions and fears of a prolonged closure of the Strait of Hormuz, a key global energy chokepoint. Analysts warn crude could climb to $150 if disruptions persist, raising inflation risks and pressuring Indian equities, which have already seen sharp declines amid foreign outflows, rupee weakness and energy supply concerns.",2026-03-15 14:11:58,,0.044,0.288,0.668,-0.9698,Negative
